{
  "schema_version": "nextstat.hepdata_import.v1",
  "mode": "catalog",
  "source": "hepdata",
  "source_mode": "direct_doi",
  "manifest": "direct",
  "datasets": [
    {
      "id": "custom.hepdata.90607.v3.r3.example",
      "name": "custom.hepdata.90607.v3.r3.example",
      "doi": "https://doi.org/10.17182/hepdata.90607.v3/r3",
      "download": {
        "url": "https://doi.org/10.17182/hepdata.90607.v3/r3",
        "mode": "cached",
        "cached": true,
        "path": "/tmp/nextstat-hepdata/cache/custom.hepdata.90607.v3.r3.example/download",
        "sha256": "7b223b5da4aae2e049593fe5c7b1563f0f54974d50c375a1a37b82c112a29551"
      },
      "inputs": {
        "bkgonly_filename": "BkgOnly.json",
        "patchset_filename": "patchset.json",
        "available_patch_names": [
          "C1N2_Wh_hbb_1000_0",
          "C1N2_Wh_hbb_175_25"
        ]
      },
      "timings": {
        "total_s": 0.13,
        "archive_prepare_s": 0.11,
        "download_s": 0.0,
        "extract_archive_s": 0.08,
        "extract_nested_archives_s": 0.03,
        "inspect_inputs_s": 0.02,
        "materialize_bkgonly_s": 0.0,
        "materialize_patches_s": 0.0,
        "materialize_total_s": 0.0
      },
      "materialize": {
        "bkgonly": true,
        "bkgonly_filename": "BkgOnly.json",
        "patchset_filename": "patchset.json",
        "patches": [
          {
            "id": "C1N2_Wh_hbb_1000_0",
            "patch_name": "C1N2_Wh_hbb_1000_0"
          },
          {
            "id": "C1N2_Wh_hbb_175_25",
            "patch_name": "C1N2_Wh_hbb_175_25"
          }
        ]
      }
    }
  ]
}
